{
  "contents": [
    {
      "role": "user",
      "parts": [
        {
          "text": "What's the weather in San Francisco?"
        }
      ]
    }
  ],
  "tools": [
    {
      "functionDeclarations": [
        {
          "name": "get_weather",
          "description": "Get the current weather for a given location.",
          "parameters": {
            "type": "OBJECT",
            "properties": {
              "location": {
                "type": "STRING",
                "description": "City and state, e.g. San Francisco, CA"
              }
            },
            "required": ["location"]
          }
        }
      ]
    }
  ],
  "toolConfig": {
    "functionCallingConfig": {
      "mode": "AUTO"
    }
  },
  "generationConfig": {
    "maxOutputTokens": 1024
  }
}
